{
  "schema_version": 1,
  "profile": "nginx",
  "cases": [
    {
      "id": "hostile0000000a",
      "host": "app.example.com",
      "scheme": "https",
      "method": "GET",
      "path": "/",
      "family": "base",
      "source": {
        "ingress": "e2e/hostile",
        "rule": 0,
        "path": 0
      }
    }
  ],
  "unsupported": [],
  "warnings": []
}
