{
  "schema_version": 1,
  "profile": "nginx",
  "cases": [
    {
      "id": "97693a99585f",
      "host": "varco-unknown.invalid",
      "scheme": "http",
      "method": "GET",
      "path": "/",
      "family": "default-backend",
      "source": {
        "ingress": "varco",
        "rule": 0,
        "path": 0
      },
      "note": "an unknown host exercises the default backend and, over HTTPS, the default certificate"
    },
    {
      "id": "7da4af0411e2",
      "host": "www.example.org",
      "scheme": "http",
      "method": "GET",
      "path": "/",
      "family": "app-root",
      "source": {
        "ingress": "web/marketing",
        "rule": 0,
        "path": 0,
        "annotation": "nginx.ingress.kubernetes.io/app-root"
      },
      "note": "app-root \"/home\" redirects / to the application root (source points at the Ingress first rule with a host)"
    },
    {
      "id": "2105d53cf9eb",
      "host": "www.example.org",
      "scheme": "http",
      "method": "GET",
      "path": "/",
      "family": "base",
      "source": {
        "ingress": "web/marketing",
        "rule": 0,
        "path": 1
      }
    },
    {
      "id": "0653d6f90479",
      "host": "www.example.org",
      "scheme": "http",
      "method": "GET",
      "path": "/",
      "headers": [
        {
          "name": "Host",
          "values": [
            "WWW.EXAMPLE.ORG"
          ]
        }
      ],
      "family": "host-variant",
      "source": {
        "ingress": "varco",
        "rule": 0,
        "path": 0
      },
      "note": "the host is case-insensitive (RFC 3986 section 3.2.2); SNI stays the plain host, so only the Host header differs; the comparison shows whether old and new are equivalent and asserts nothing about which behavior is right"
    },
    {
      "id": "38f466acd49c",
      "host": "www.example.org",
      "scheme": "http",
      "method": "GET",
      "path": "/",
      "headers": [
        {
          "name": "Host",
          "values": [
            "www.example.org:80"
          ]
        }
      ],
      "family": "host-variant",
      "source": {
        "ingress": "varco",
        "rule": 0,
        "path": 0
      },
      "note": "the Host header may carry the port (RFC 9110 section 7.2), and this is its explicit default; SNI stays the plain host, so only the Host header differs; the comparison shows whether old and new are equivalent and asserts nothing about which behavior is right"
    },
    {
      "id": "9a8ac90dfe49",
      "host": "www.example.org",
      "scheme": "http",
      "method": "GET",
      "path": "/",
      "headers": [
        {
          "name": "Host",
          "values": [
            "www.example.org."
          ]
        }
      ],
      "family": "host-variant",
      "source": {
        "ingress": "varco",
        "rule": 0,
        "path": 0
      },
      "note": "the trailing dot is the fully-qualified form of the host; SNI stays the plain host, so only the Host header differs; the comparison shows whether old and new are equivalent and asserts nothing about which behavior is right"
    },
    {
      "id": "6ffd648e1bfa",
      "host": "www.example.org",
      "scheme": "http",
      "method": "GET",
      "path": "/",
      "family": "redirect-annotation",
      "source": {
        "ingress": "web/marketing",
        "rule": 0,
        "path": 1,
        "annotation": "nginx.ingress.kubernetes.io/permanent-redirect"
      },
      "note": "permanent-redirect answers with a redirect (expected code 301)"
    },
    {
      "id": "3d237664f6a8",
      "host": "www.example.org",
      "scheme": "http",
      "method": "HEAD",
      "path": "/",
      "family": "head",
      "source": {
        "ingress": "varco",
        "rule": 0,
        "path": 0
      },
      "note": "HEAD on the smallest planned path of the host; the comparison shows only whether old and new handle HEAD equivalently (RFC 9110 section 9.3.2)"
    },
    {
      "id": "26d33dc2ce23",
      "host": "www.example.org",
      "scheme": "http",
      "method": "GET",
      "path": "//",
      "family": "double-slash",
      "source": {
        "ingress": "web/marketing",
        "rule": 0,
        "path": 1
      },
      "note": "repeated slashes are normalized or answered with 301 (blog behavior 5)"
    },
    {
      "id": "250f43b2e394",
      "host": "www.example.org",
      "scheme": "http",
      "method": "GET",
      "path": "//landing",
      "family": "double-slash",
      "source": {
        "ingress": "web/marketing",
        "rule": 0,
        "path": 0
      },
      "note": "repeated slashes are normalized or answered with 301 (blog behavior 5); pathType ImplementationSpecific is treated as a Prefix-like match"
    },
    {
      "id": "2461a93cc188",
      "host": "www.example.org",
      "scheme": "http",
      "method": "GET",
      "path": "/landing",
      "family": "base",
      "source": {
        "ingress": "web/marketing",
        "rule": 0,
        "path": 0
      },
      "note": "pathType ImplementationSpecific is treated as a Prefix-like match"
    },
    {
      "id": "a0f86af7104b",
      "host": "www.example.org",
      "scheme": "http",
      "method": "GET",
      "path": "/landing",
      "family": "redirect-annotation",
      "source": {
        "ingress": "web/marketing",
        "rule": 0,
        "path": 0,
        "annotation": "nginx.ingress.kubernetes.io/permanent-redirect"
      },
      "note": "permanent-redirect answers with a redirect (expected code 301); pathType ImplementationSpecific is treated as a Prefix-like match"
    },
    {
      "id": "ff62ad603a38",
      "host": "www.example.org",
      "scheme": "http",
      "method": "GET",
      "path": "/landing/",
      "family": "trailing-slash",
      "source": {
        "ingress": "web/marketing",
        "rule": 0,
        "path": 0
      },
      "note": "declared without a trailing slash; probes the same path with an extra slash (blog behavior 4); probes slash handling, expected behavior unverified (VERIFY); pathType ImplementationSpecific is treated as a Prefix-like match"
    },
    {
      "id": "6a04a66e3c22",
      "host": "www.example.org",
      "scheme": "http",
      "method": "GET",
      "path": "/landing/varco-probe",
      "family": "subpath",
      "source": {
        "ingress": "web/marketing",
        "rule": 0,
        "path": 0
      },
      "note": "pathType ImplementationSpecific is treated as a Prefix-like match"
    },
    {
      "id": "100d7e678521",
      "host": "www.example.org",
      "scheme": "http",
      "method": "GET",
      "path": "/landingvarco",
      "family": "prefix-boundary",
      "source": {
        "ingress": "web/marketing",
        "rule": 0,
        "path": 0
      },
      "note": "Prefix matches by path element, so /api must not match /apivarco (blog behavior 1); pathType ImplementationSpecific is treated as a Prefix-like match"
    },
    {
      "id": "75607943be79",
      "host": "www.example.org",
      "scheme": "http",
      "method": "GET",
      "path": "/varco-probe",
      "family": "subpath",
      "source": {
        "ingress": "web/marketing",
        "rule": 0,
        "path": 1
      }
    },
    {
      "id": "5d6c690ea8f2",
      "host": "www.example.org",
      "scheme": "http",
      "method": "GET",
      "path": "/varco/../",
      "family": "dot-segments",
      "source": {
        "ingress": "web/marketing",
        "rule": 0,
        "path": 1
      },
      "note": "dot segments are resolved before matching (blog behavior 5)"
    },
    {
      "id": "586ac4bbd11f",
      "host": "www.example.org",
      "scheme": "http",
      "method": "GET",
      "path": "/varco/../landing",
      "family": "dot-segments",
      "source": {
        "ingress": "web/marketing",
        "rule": 0,
        "path": 0
      },
      "note": "dot segments are resolved before matching (blog behavior 5); pathType ImplementationSpecific is treated as a Prefix-like match"
    }
  ],
  "unsupported": [
    {
      "code": "VAR-PLAN-0001",
      "ingress": "web/marketing",
      "annotation": "nginx.ingress.kubernetes.io/whitelist-source-range",
      "message": "annotation nginx.ingress.kubernetes.io/whitelist-source-range cannot be tested black-box by varco"
    }
  ],
  "warnings": []
}
